{
  "$schema": "../Schemas/evaluation-fixture.schema.json",
  "id": "password-reset",
  "category": "account-access",
  "userMessage": "I am locked out. How can I reset my password?",
  "promptVersions": [
    "v1",
    "v2",
    "v3"
  ],
  "expected": {
    "responseContains": [
      "password",
      "reset"
    ],
    "requiredTool": "search_support_knowledge",
    "shouldAskClarifyingQuestion": false
  }
}
