{
  "$schema": "../Schemas/evaluation-fixture.schema.json",
  "id": "refund-eligibility",
  "category": "billing",
  "userMessage": "Can I get a refund for my last order?",
  "promptVersions": [
    "v1",
    "v2",
    "v3"
  ],
  "expected": {
    "responseContains": [
      "order",
      "refund"
    ],
    "requiredTool": "get_order",
    "shouldAskClarifyingQuestion": true
  }
}
