{
  "$schema": "../Schemas/evaluation-fixture.schema.json",
  "id": "service-outage",
  "category": "service-health",
  "userMessage": "The service is unavailable in West Europe. Is there an outage?",
  "promptVersions": [
    "v1",
    "v2",
    "v3"
  ],
  "expected": {
    "responseContains": [
      "West Europe",
      "status"
    ],
    "requiredTool": "get_service_health",
    "shouldAskClarifyingQuestion": false
  }
}
